{
  "$schema": "http://json-schema.org/draft-07/schema#",
  "$id": "league.schema.json",
  "title": "League config",
  "type": "object",
  "required": ["platform", "teams", "draft", "roster", "season"],
  "additionalProperties": false,
  "properties": {
    "platform": { "type": "string", "enum": ["yahoo", "espn", "sleeper", "mfl", "fleaflicker"] },
    "teams": {
      "description": "Nullable until Pete confirms league size. Filled by sweep mode otherwise.",
      "type": ["integer", "null"],
      "minimum": 4,
      "maximum": 20
    },
    "draft": {
      "type": "object",
      "required": ["type", "my_slot", "rounds"],
      "additionalProperties": false,
      "properties": {
        "type": { "type": "string", "enum": ["snake", "auction", "linear"] },
        "my_slot": {
          "description": "Nullable until Pete confirms draft slot. Filled by sweep mode otherwise.",
          "type": ["integer", "null"],
          "minimum": 1
        },
        "rounds": { "type": "integer", "minimum": 1 },
        "defer_until_round": {
          "description": "Positions not to recommend before the given round, even when a starter slot is open. For positions whose VOR spread is real but unpredictable (K especially), last season's points carry almost no signal for next season, so spending an early pick on the leader buys noise. Keys are position codes, values are the first round the position may be recommended in. Omit or leave empty to disable.",
          "type": "object",
          "additionalProperties": { "type": "integer", "minimum": 1 }
        }
      }
    },
    "roster": {
      "type": "object",
      "required": ["starters", "flex_eligible", "bench"],
      "additionalProperties": false,
      "properties": {
        "starters": {
          "type": "object",
          "additionalProperties": { "type": "integer", "minimum": 0 }
        },
        "flex_eligible": {
          "type": "object",
          "additionalProperties": {
            "type": "array",
            "items": { "type": "string", "enum": ["QB", "RB", "WR", "TE", "K", "DST"] }
          }
        },
        "bench": { "type": "integer", "minimum": 0 },
        "ir": { "type": "integer", "minimum": 0 },
        "max_at_position": {
          "description": "Most players worth rostering at each position, starters included. Governs bench recommendations once every starter slot is filled: a league starting one QB has no use for a third, so the position drops out of consideration at 2 and the pick goes to a position that can still pay. Keys are position codes. Omit a position to leave it uncapped.",
          "type": "object",
          "additionalProperties": { "type": "integer", "minimum": 0 }
        }
      }
    },
    "season": {
      "type": "object",
      "required": ["regular_weeks", "playoff_weeks", "playoff_teams"],
      "additionalProperties": false,
      "properties": {
        "regular_weeks": {
          "type": "array", "items": { "type": "integer" }, "minItems": 2, "maxItems": 2
        },
        "playoff_weeks": {
          "type": "array", "items": { "type": "integer" }, "minItems": 2, "maxItems": 2
        },
        "playoff_teams": { "type": "integer", "minimum": 2 }
      }
    }
  }
}
